{
  "$schema": "https://json-schema.org/draft/2020-12/schema",
  "title": "POSEIDON Optimization Input",
  "description": "Optimization experiment input for POSEIDON policy and parameter search.",
  "type": "object",
  "required": [
    "baseScenario",
    "parameters",
    "objective"
  ],
  "properties": {
    "baseScenario": {
      "oneOf": [
        {
          "type": "string"
        },
        {
          "$ref": "https://ogcincubator.github.io/bblocks-seadots/build/annotated/hosted/seadots/poseidon-input-scenario/schema.json"
        }
      ],
      "x-jsonld-id": "http://www.w3.org/ns/prov#used"
    },
    "algorithm": {
      "type": "string",
      "default": "Bayesian optimization",
      "x-jsonld-id": "https://schema.org/algorithm"
    },
    "parameters": {
      "type": "array",
      "minItems": 1,
      "items": {
        "type": "object",
        "required": [
          "name",
          "adaptor"
        ],
        "properties": {
          "name": {
            "type": "string"
          },
          "adaptor": {
            "type": "string",
            "description": "POSEIDON parameter adaptor path or implementation name."
          },
          "lowerBound": {
            "type": "number"
          },
          "upperBound": {
            "type": "number"
          },
          "values": {
            "type": "array"
          }
        }
      },
      "x-jsonld-id": "https://schema.org/variableMeasured",
      "x-jsonld-container": "@list"
    },
    "objective": {
      "type": "object",
      "required": [
        "metric"
      ],
      "properties": {
        "metric": {
          "type": "string"
        },
        "direction": {
          "type": "string",
          "enum": [
            "minimize",
            "maximize"
          ]
        },
        "expression": {
          "type": "string"
        }
      },
      "additionalProperties": true,
      "x-jsonld-id": "https://schema.org/target"
    },
    "simulationBudget": {
      "type": "integer",
      "minimum": 1
    },
    "seed": {
      "type": "integer"
    },
    "replicatesPerEvaluation": {
      "type": "integer",
      "minimum": 1
    }
  },
  "additionalProperties": true,
  "x-jsonld-vocab": "https://w3id.org/iliad/seadots/poseidon/input#",
  "x-jsonld-prefixes": {
    "prov": "http://www.w3.org/ns/prov#",
    "schema": "https://schema.org/"
  }
}